{
  "schemaVersion": "1.0.0",
  "kind": "external-asset-package",
  "importer": "shader",
  "source": "outline-solid.wgsl",
  "importSettings": {
    "materialShaderIdentifier": "learn-render::outline-solid"
  },
  "subAssets": [
    {
      "guid": "01999902-0000-0000-0000-000000000001",
      "sourceIndex": 0,
      "kind": "material-shader"
    }
  ],
  "paramSchema": [
    { "name": "baseColor", "type": "color" }
  ]
}
