{
  "schemaVersion": "1.0.0",
  "kind": "external-asset-package",
  "importer": "shader",
  "source": "msdf-text.wgsl",
  "importSettings": {
    "materialShaderIdentifier": "forgeax::msdf-text"
  },
  "subAssets": [
    {
      "guid": "b8f92146-3b24-519b-97a2-271419b53563",
      "sourceIndex": 0,
      "kind": "material-shader"
    }
  ]
}
