{
  "schemaVersion": "1.0.0",
  "kind": "external-asset-package",
  "importer": "shader",
  "source": "default-standard-pbr.wgsl",
  "importSettings": {
    "materialShaderIdentifier": "forgeax::default-standard-pbr"
  },
  "subAssets": [
    {
      "guid": "499bde4f-e9a6-4312-9c23-e9d8e734ed4c",
      "sourceIndex": 0,
      "kind": "material-shader"
    }
  ],
  "paramSchema": [
    {
      "name": "baseColor",
      "type": "color",
      "default": [1.0, 1.0, 1.0, 1.0]
    },
    {
      "name": "metallic",
      "type": "f32",
      "default": 0.0
    },
    {
      "name": "roughness",
      "type": "f32",
      "default": 0.5
    },
    {
      "name": "metallicChannel",
      "type": "f32",
      "default": 2.0
    },
    {
      "name": "roughnessChannel",
      "type": "f32",
      "default": 1.0
    },
    {
      "name": "aoChannel",
      "type": "f32",
      "default": 0.0
    },
    {
      "name": "extraChannel",
      "type": "f32",
      "default": 0.0
    },
    {
      "name": "emissive",
      "type": "vec3",
      "default": [0.0, 0.0, 0.0]
    },
    {
      "name": "emissiveIntensity",
      "type": "f32",
      "default": 0.0
    },
    {
      "name": "occlusionStrength",
      "type": "f32",
      "default": 1.0
    },
    {
      "name": "uvSet",
      "type": "f32",
      "default": 0.0
    },
    {
      "name": "alphaCutoff",
      "type": "f32",
      "default": 0.0
    },
    {
      "name": "clearcoat",
      "type": "f32",
      "default": 0.0
    },
    {
      "name": "clearcoatRoughness",
      "type": "f32",
      "default": 0.5
    },
    {
      "name": "baseColorTexture",
      "type": "texture2d"
    },
    {
      "name": "metallicRoughnessTexture",
      "type": "texture2d"
    },
    {
      "name": "normalTexture",
      "type": "texture2d"
    }
  ]
}
