{
  "schemaVersion": "1.0.0",
  "kind": "external-asset-package",
  "importer": "shader",
  "source": "hdrp-cluster-forward.wgsl",
  "importSettings": {
    "materialShaderIdentifier": "forgeax_hdrp::cluster_forward"
  },
  "subAssets": [
    {
      "guid": "a1b2c3d4-e5f6-4789-abcd-ef0123456789",
      "sourceIndex": 0,
      "kind": "material-shader"
    }
  ]
}
